1	te gusta el fútbol		19	-1	Cuentame, ¿Que hay de nuevo?	0
2	dónde queda Inglaterra	dónde queda Inglaterra	0	0.96228975	Inglaterra está ubicada en una pequeña isla frente a la costa de Europa.	1
3	que inventos conoces	que inventó	10	0.84079218	¿Que dijiste?	0
4	mas o menos que inventos conoces	Mahou menos que inventó conocí	8	0.87579918	Repite porfavor	1
5	te voy a hacer otra pregunta	qué voy a hacer otra pregunta	4	0.78146261	Qué crees?	0
6	háblame de la historia de la inteligencia artificial	háblame de la historia de la inteligencia	11	0.9311071	No he escuchado bien, podrias repetir lo que haz dicho.	1
7	inteligencia artificial conoces su historia		43	-1	Cuentame, ¿Que hay de nuevo?	0
8	playa gorgona		13	-1	¿Dónde te gustaría ir de vacaciones?	0
